{
  "schema_version": 1,
  "license_spdx": "Apache-2.0",
  "copyright_holder": "Fixture Copyright",
  "public_author": {
    "name": "fixture-author",
    "email": "12345678+fixture-author@users.noreply.github.com"
  },
  "github": {
    "owner": "fixture-owner",
    "repository": "fixture-repository",
    "default_branch": "main"
  },
  "security_reporting": {
    "type": "github_private_vulnerability_reporting",
    "url": "https://github.com/fixture-owner/fixture-repository/security/advisories/new",
    "acknowledgement_days": 7,
    "triage_days": 14
  },
  "contribution_policy": {
    "issues": true,
    "pull_requests": true,
    "dco_required": true,
    "cla_required": false,
    "response_sla_days": null,
    "merge_guarantee": false,
    "bug_bounty": false
  },
  "initial_version": "1.0.0"
}
